"DESCRIPTION","DURATION IN MS","NAME","PARENT SUITE","START TIME","STATUS","STOP TIME","SUB SUITE","SUITE","TEST CLASS","TEST METHOD"
"","2019","A005-user should not be able to login with invalid username and valid password","","Tue Oct 07 03:35:04 UTC 2025","passed","Tue Oct 07 03:35:06 UTC 2025","","OrangeHRM Login Feature","OrangeHRM Login Feature","A005-user should not be able to login with invalid username and valid password"
"","2084","A002-user should not be able to login with invalid credentials","","Tue Oct 07 03:34:59 UTC 2025","passed","Tue Oct 07 03:35:01 UTC 2025","","OrangeHRM Login Feature","OrangeHRM Login Feature","A002-user should not be able to login with invalid credentials"
"","2337","A004-user should not be able to login with valid username and invalid password","","Tue Oct 07 03:35:02 UTC 2025","passed","Tue Oct 07 03:35:04 UTC 2025","","OrangeHRM Login Feature","OrangeHRM Login Feature","A004-user should not be able to login with valid username and invalid password"
"","6077","A001-user should be able to login with valid credentials","","Tue Oct 07 03:34:53 UTC 2025","passed","Tue Oct 07 03:34:59 UTC 2025","","OrangeHRM Login Feature","OrangeHRM Login Feature","A001-user should be able to login with valid credentials"
"","1147","A003-user should not be able to login with blank credentials","","Tue Oct 07 03:35:01 UTC 2025","passed","Tue Oct 07 03:35:02 UTC 2025","","OrangeHRM Login Feature","OrangeHRM Login Feature","A003-user should not be able to login with blank credentials"
"","6010","A006-user should be able to search menu items with valid menu name","","Tue Oct 07 03:35:22 UTC 2025","passed","Tue Oct 07 03:35:28 UTC 2025","","OrangeHRM Menu Search Feature","OrangeHRM Menu Search Feature","A006-user should be able to search menu items with valid menu name"
"","7731","A001-user should be able to add candidate with valid details","","Tue Oct 07 03:35:10 UTC 2025","broken","Tue Oct 07 03:35:18 UTC 2025","","OrangeHRM Recruitment Feature","OrangeHRM Recruitment Feature","A001-user should be able to add candidate with valid details"
